Running Ablation 3: Exploration Rate...

============================================================
ABLATION 3: EXPLORATION RATE
============================================================

Testing exploration_rate=0.05
ε=0.05:   0%|          | 0/5 [00:00<?, ?it/s]ε=0.05:  20%|██        | 1/5 [00:01<00:04,  1.14s/it]ε=0.05:  40%|████      | 2/5 [00:02<00:03,  1.24s/it]ε=0.05:  60%|██████    | 3/5 [00:03<00:02,  1.17s/it]ε=0.05:  80%|████████  | 4/5 [00:04<00:01,  1.17s/it]ε=0.05: 100%|██████████| 5/5 [00:06<00:00,  1.22s/it]ε=0.05: 100%|██████████| 5/5 [00:06<00:00,  1.20s/it]
  SI: 0.857±0.014
  Reward: 126.5±20.6

Testing exploration_rate=0.1
ε=0.1:   0%|          | 0/5 [00:00<?, ?it/s]ε=0.1:  20%|██        | 1/5 [00:01<00:04,  1.11s/it]ε=0.1:  40%|████      | 2/5 [00:02<00:03,  1.13s/it]ε=0.1:  60%|██████    | 3/5 [00:03<00:02,  1.11s/it]ε=0.1:  80%|████████  | 4/5 [00:04<00:01,  1.19s/it]ε=0.1: 100%|██████████| 5/5 [00:05<00:00,  1.22s/it]ε=0.1: 100%|██████████| 5/5 [00:05<00:00,  1.18s/it]
  SI: 0.865±0.014
  Reward: 113.0±24.9

Testing exploration_rate=0.15
ε=0.15:   0%|          | 0/5 [00:00<?, ?it/s]ε=0.15:  20%|██        | 1/5 [00:01<00:04,  1.25s/it]ε=0.15:  40%|████      | 2/5 [00:02<00:03,  1.20s/it]ε=0.15:  60%|██████    | 3/5 [00:03<00:02,  1.16s/it]ε=0.15:  80%|████████  | 4/5 [00:04<00:01,  1.16s/it]ε=0.15: 100%|██████████| 5/5 [00:05<00:00,  1.19s/it]ε=0.15: 100%|██████████| 5/5 [00:05<00:00,  1.19s/it]
  SI: 0.843±0.040
  Reward: 127.7±24.9

Testing exploration_rate=0.2
ε=0.2:   0%|          | 0/5 [00:00<?, ?it/s]ε=0.2:  20%|██        | 1/5 [00:01<00:04,  1.16s/it]ε=0.2:  40%|████      | 2/5 [00:02<00:03,  1.15s/it]ε=0.2:  60%|██████    | 3/5 [00:03<00:02,  1.37s/it]ε=0.2:  80%|████████  | 4/5 [00:05<00:01,  1.33s/it]ε=0.2: 100%|██████████| 5/5 [00:06<00:00,  1.30s/it]ε=0.2: 100%|██████████| 5/5 [00:06<00:00,  1.29s/it]
  SI: 0.854±0.016
  Reward: 124.7±20.4

Testing exploration_rate=0.25
ε=0.25:   0%|          | 0/5 [00:00<?, ?it/s]ε=0.25:  20%|██        | 1/5 [00:01<00:04,  1.18s/it]ε=0.25:  40%|████      | 2/5 [00:02<00:03,  1.17s/it]ε=0.25:  60%|██████    | 3/5 [00:03<00:02,  1.15s/it]ε=0.25:  80%|████████  | 4/5 [00:04<00:01,  1.15s/it]ε=0.25: 100%|██████████| 5/5 [00:05<00:00,  1.16s/it]ε=0.25: 100%|██████████| 5/5 [00:05<00:00,  1.16s/it]
  SI: 0.857±0.022
  Reward: 114.4±19.8

Testing exploration_rate=0.3
ε=0.3:   0%|          | 0/5 [00:00<?, ?it/s]ε=0.3:  20%|██        | 1/5 [00:01<00:05,  1.27s/it]ε=0.3:  40%|████      | 2/5 [00:02<00:03,  1.20s/it]ε=0.3:  60%|██████    | 3/5 [00:03<00:02,  1.17s/it]ε=0.3:  80%|████████  | 4/5 [00:04<00:01,  1.19s/it]ε=0.3: 100%|██████████| 5/5 [00:05<00:00,  1.16s/it]ε=0.3: 100%|██████████| 5/5 [00:05<00:00,  1.17s/it]
  SI: 0.819±0.063
  Reward: 114.6±30.1

============================================================
ABLATION 3 RESULTS: EXPLORATION RATE
============================================================
         ε |              SI |          Reward
--------------------------------------------------
      0.05 |   0.857±0.014 |   126.5±20.6
      0.10 |   0.865±0.014 |   113.0±24.9
      0.15 |   0.843±0.040 |   127.7±24.9
      0.20 |   0.854±0.016 |   124.7±20.4
      0.25 |   0.857±0.022 |   114.4±19.8
      0.30 |   0.819±0.063 |   114.6±30.1

Running Ablation 4: Inventory Size...

============================================================
ABLATION 4: METHOD INVENTORY SIZE
============================================================

Testing inventory_size=4
size=4:   0%|          | 0/5 [00:00<?, ?it/s]size=4:  20%|██        | 1/5 [00:00<00:02,  1.97it/s]size=4:  40%|████      | 2/5 [00:00<00:01,  2.01it/s]size=4:  60%|██████    | 3/5 [00:01<00:01,  1.95it/s]size=4:  80%|████████  | 4/5 [00:02<00:00,  1.87it/s]size=4: 100%|██████████| 5/5 [00:02<00:00,  1.91it/s]size=4: 100%|██████████| 5/5 [00:02<00:00,  1.92it/s]
  SI: 0.860±0.023
  Reward: 91.4±17.7
  Coverage: 1.00

Testing inventory_size=6
size=6:   0%|          | 0/5 [00:00<?, ?it/s]size=6:  20%|██        | 1/5 [00:00<00:02,  1.60it/s]size=6:  40%|████      | 2/5 [00:01<00:01,  1.61it/s]size=6:  60%|██████    | 3/5 [00:01<00:01,  1.62it/s]size=6:  80%|████████  | 4/5 [00:02<00:00,  1.61it/s]size=6: 100%|██████████| 5/5 [00:03<00:00,  1.50it/s]size=6: 100%|██████████| 5/5 [00:03<00:00,  1.55it/s]
  SI: 0.851±0.045
  Reward: 94.7±16.7
  Coverage: 1.00

Testing inventory_size=8
size=8:   0%|          | 0/5 [00:00<?, ?it/s]size=8:  20%|██        | 1/5 [00:00<00:03,  1.31it/s]size=8:  40%|████      | 2/5 [00:01<00:02,  1.33it/s]size=8:  60%|██████    | 3/5 [00:02<00:01,  1.32it/s]size=8:  80%|████████  | 4/5 [00:03<00:00,  1.33it/s]size=8: 100%|██████████| 5/5 [00:03<00:00,  1.37it/s]size=8: 100%|██████████| 5/5 [00:03<00:00,  1.35it/s]
  SI: 0.857±0.025
  Reward: 104.3±17.5
  Coverage: 1.00

Testing inventory_size=10
size=10:   0%|          | 0/5 [00:00<?, ?it/s]size=10:  20%|██        | 1/5 [00:01<00:04,  1.10s/it]size=10:  40%|████      | 2/5 [00:02<00:03,  1.11s/it]size=10:  60%|██████    | 3/5 [00:03<00:02,  1.38s/it]size=10:  80%|████████  | 4/5 [00:05<00:01,  1.30s/it]size=10: 100%|██████████| 5/5 [00:06<00:00,  1.26s/it]size=10: 100%|██████████| 5/5 [00:06<00:00,  1.26s/it]
  SI: 0.839±0.054
  Reward: 109.8±20.9
  Coverage: 1.00

Testing inventory_size=12
size=12:   0%|          | 0/5 [00:00<?, ?it/s]size=12:  20%|██        | 1/5 [00:01<00:04,  1.15s/it]size=12:  40%|████      | 2/5 [00:02<00:03,  1.12s/it]size=12:  60%|██████    | 3/5 [00:03<00:02,  1.19s/it]size=12:  80%|████████  | 4/5 [00:04<00:01,  1.16s/it]size=12: 100%|██████████| 5/5 [00:05<00:00,  1.18s/it]size=12: 100%|██████████| 5/5 [00:05<00:00,  1.17s/it]
  SI: 0.860±0.012
  Reward: 115.6±21.7
  Coverage: 1.00

============================================================
ABLATION 4 RESULTS: INVENTORY SIZE
============================================================
      Size |              SI |          Reward |   Coverage
------------------------------------------------------------
         4 |   0.860±0.023 |    91.4±17.7 |       1.00
         6 |   0.851±0.045 |    94.7±16.7 |       1.00
         8 |   0.857±0.025 |   104.3±17.5 |       1.00
        10 |   0.839±0.054 |   109.8±20.9 |       1.00
        12 |   0.860±0.012 |   115.6±21.7 |       1.00

Ablations 3 & 4 complete!
