============================================================
TIER-1 DOMAIN SCREENING EXPERIMENT
============================================================
Trials per domain: 30
Iterations per trial: 2000
Agents per population: 8
============================================================

>>> Testing domain: air_quality
air_quality:   0%|          | 0/30 [00:00<?, ?it/s]air_quality:   3%|▎         | 1/30 [00:00<00:13,  2.16it/s]air_quality:   7%|▋         | 2/30 [00:00<00:11,  2.45it/s]air_quality:  10%|█         | 3/30 [00:01<00:10,  2.57it/s]air_quality:  13%|█▎        | 4/30 [00:01<00:09,  2.63it/s]air_quality:  17%|█▋        | 5/30 [00:01<00:09,  2.67it/s]air_quality:  20%|██        | 6/30 [00:02<00:08,  2.71it/s]air_quality:  23%|██▎       | 7/30 [00:02<00:08,  2.71it/s]air_quality:  27%|██▋       | 8/30 [00:03<00:08,  2.72it/s]air_quality:  30%|███       | 9/30 [00:03<00:07,  2.73it/s]air_quality:  33%|███▎      | 10/30 [00:03<00:07,  2.74it/s]air_quality:  37%|███▋      | 11/30 [00:04<00:06,  2.74it/s]air_quality:  40%|████      | 12/30 [00:04<00:06,  2.74it/s]air_quality:  43%|████▎     | 13/30 [00:04<00:06,  2.50it/s]air_quality:  47%|████▋     | 14/30 [00:05<00:06,  2.42it/s]air_quality:  50%|█████     | 15/30 [00:06<00:11,  1.34it/s]air_quality:  53%|█████▎    | 16/30 [00:07<00:09,  1.42it/s]air_quality:  57%|█████▋    | 17/30 [00:07<00:07,  1.66it/s]air_quality:  60%|██████    | 18/30 [00:08<00:06,  1.88it/s]air_quality:  63%|██████▎   | 19/30 [00:08<00:05,  2.08it/s]air_quality:  67%|██████▋   | 20/30 [00:08<00:04,  2.24it/s]air_quality:  70%|███████   | 21/30 [00:09<00:03,  2.37it/s]air_quality:  73%|███████▎  | 22/30 [00:09<00:03,  2.48it/s]air_quality:  77%|███████▋  | 23/30 [00:10<00:02,  2.55it/s]air_quality:  80%|████████  | 24/30 [00:10<00:02,  2.61it/s]air_quality:  83%|████████▎ | 25/30 [00:10<00:01,  2.66it/s]air_quality:  87%|████████▋ | 26/30 [00:11<00:01,  2.68it/s]air_quality:  90%|█████████ | 27/30 [00:11<00:01,  2.70it/s]air_quality:  93%|█████████▎| 28/30 [00:11<00:00,  2.72it/s]air_quality:  97%|█████████▋| 29/30 [00:12<00:00,  2.73it/s]air_quality: 100%|██████████| 30/30 [00:12<00:00,  2.74it/s]air_quality: 100%|██████████| 30/30 [00:12<00:00,  2.38it/s]
    SI: 0.491 ± 0.018
    Improvement: -11.2% ± 0.3%
    Regimes: 4
    Verdict: APPENDIX

>>> Testing domain: wikipedia
wikipedia:   0%|          | 0/30 [00:00<?, ?it/s]wikipedia:   3%|▎         | 1/30 [00:00<00:07,  3.82it/s]wikipedia:   7%|▋         | 2/30 [00:00<00:07,  3.82it/s]wikipedia:  10%|█         | 3/30 [00:00<00:07,  3.82it/s]wikipedia:  13%|█▎        | 4/30 [00:01<00:06,  3.83it/s]wikipedia:  17%|█▋        | 5/30 [00:01<00:06,  3.83it/s]wikipedia:  20%|██        | 6/30 [00:01<00:06,  3.83it/s]wikipedia:  23%|██▎       | 7/30 [00:01<00:06,  3.82it/s]wikipedia:  27%|██▋       | 8/30 [00:02<00:05,  3.81it/s]wikipedia:  30%|███       | 9/30 [00:02<00:05,  3.83it/s]wikipedia:  33%|███▎      | 10/30 [00:02<00:05,  3.81it/s]wikipedia:  37%|███▋      | 11/30 [00:02<00:04,  3.80it/s]wikipedia:  40%|████      | 12/30 [00:03<00:04,  3.81it/s]wikipedia:  43%|████▎     | 13/30 [00:03<00:04,  3.82it/s]wikipedia:  47%|████▋     | 14/30 [00:03<00:04,  3.66it/s]wikipedia:  50%|█████     | 15/30 [00:03<00:04,  3.70it/s]wikipedia:  53%|█████▎    | 16/30 [00:04<00:03,  3.73it/s]wikipedia:  57%|█████▋    | 17/30 [00:04<00:03,  3.75it/s]wikipedia:  60%|██████    | 18/30 [00:04<00:03,  3.76it/s]wikipedia:  63%|██████▎   | 19/30 [00:05<00:02,  3.78it/s]wikipedia:  67%|██████▋   | 20/30 [00:05<00:02,  3.80it/s]wikipedia:  70%|███████   | 21/30 [00:05<00:02,  3.80it/s]wikipedia:  73%|███████▎  | 22/30 [00:05<00:02,  3.82it/s]wikipedia:  77%|███████▋  | 23/30 [00:06<00:01,  3.82it/s]wikipedia:  80%|████████  | 24/30 [00:06<00:01,  3.82it/s]wikipedia:  83%|████████▎ | 25/30 [00:06<00:01,  3.81it/s]wikipedia:  87%|████████▋ | 26/30 [00:06<00:01,  3.81it/s]wikipedia:  90%|█████████ | 27/30 [00:07<00:00,  3.81it/s]wikipedia:  93%|█████████▎| 28/30 [00:07<00:00,  3.83it/s]wikipedia:  97%|█████████▋| 29/30 [00:07<00:00,  3.71it/s]wikipedia: 100%|██████████| 30/30 [00:07<00:00,  3.74it/s]wikipedia: 100%|██████████| 30/30 [00:07<00:00,  3.79it/s]
    SI: 0.544 ± 0.011
    Improvement: -3.5% ± 0.2%
    Regimes: 4
    Verdict: APPENDIX

>>> Testing domain: solar
solar:   0%|          | 0/30 [00:00<?, ?it/s]solar:   3%|▎         | 1/30 [00:00<00:11,  2.60it/s]solar:   7%|▋         | 2/30 [00:00<00:10,  2.60it/s]solar:  10%|█         | 3/30 [00:01<00:10,  2.62it/s]solar:  13%|█▎        | 4/30 [00:01<00:09,  2.62it/s]solar:  17%|█▋        | 5/30 [00:01<00:10,  2.48it/s]solar:  20%|██        | 6/30 [00:02<00:09,  2.44it/s]solar:  23%|██▎       | 7/30 [00:02<00:09,  2.49it/s]solar:  27%|██▋       | 8/30 [00:03<00:08,  2.52it/s]solar:  30%|███       | 9/30 [00:03<00:08,  2.55it/s]solar:  33%|███▎      | 10/30 [00:03<00:07,  2.57it/s]solar:  37%|███▋      | 11/30 [00:04<00:07,  2.58it/s]solar:  40%|████      | 12/30 [00:04<00:06,  2.59it/s]solar:  43%|████▎     | 13/30 [00:05<00:06,  2.59it/s]solar:  47%|████▋     | 14/30 [00:05<00:06,  2.61it/s]solar:  50%|█████     | 15/30 [00:05<00:05,  2.60it/s]solar:  53%|█████▎    | 16/30 [00:06<00:05,  2.60it/s]solar:  57%|█████▋    | 17/30 [00:06<00:05,  2.60it/s]solar:  60%|██████    | 18/30 [00:07<00:04,  2.59it/s]solar:  63%|██████▎   | 19/30 [00:07<00:04,  2.60it/s]solar:  67%|██████▋   | 20/30 [00:07<00:03,  2.60it/s]solar:  70%|███████   | 21/30 [00:08<00:03,  2.60it/s]solar:  73%|███████▎  | 22/30 [00:08<00:03,  2.60it/s]solar:  77%|███████▋  | 23/30 [00:08<00:02,  2.60it/s]solar:  80%|████████  | 24/30 [00:09<00:02,  2.59it/s]solar:  83%|████████▎ | 25/30 [00:09<00:01,  2.59it/s]solar:  87%|████████▋ | 26/30 [00:10<00:01,  2.60it/s]solar:  90%|█████████ | 27/30 [00:10<00:01,  2.60it/s]solar:  93%|█████████▎| 28/30 [00:10<00:00,  2.60it/s]solar:  97%|█████████▋| 29/30 [00:11<00:00,  2.59it/s]solar: 100%|██████████| 30/30 [00:11<00:00,  2.57it/s]solar: 100%|██████████| 30/30 [00:11<00:00,  2.58it/s]
    SI: 0.856 ± 0.040
    Improvement: 11.0% ± 1.2%
    Regimes: 3
    Verdict: INCLUDE

>>> Testing domain: water
water:   0%|          | 0/30 [00:00<?, ?it/s]water:   3%|▎         | 1/30 [00:00<00:11,  2.55it/s]water:   7%|▋         | 2/30 [00:00<00:10,  2.55it/s]water:  10%|█         | 3/30 [00:01<00:10,  2.56it/s]water:  13%|█▎        | 4/30 [00:01<00:10,  2.55it/s]water:  17%|█▋        | 5/30 [00:01<00:09,  2.55it/s]water:  20%|██        | 6/30 [00:02<00:09,  2.56it/s]water:  23%|██▎       | 7/30 [00:02<00:08,  2.56it/s]water:  27%|██▋       | 8/30 [00:03<00:08,  2.56it/s]water:  30%|███       | 9/30 [00:03<00:08,  2.55it/s]water:  33%|███▎      | 10/30 [00:03<00:07,  2.55it/s]water:  37%|███▋      | 11/30 [00:04<00:07,  2.56it/s]water:  40%|████      | 12/30 [00:04<00:07,  2.56it/s]water:  43%|████▎     | 13/30 [00:05<00:06,  2.56it/s]water:  47%|████▋     | 14/30 [00:05<00:06,  2.56it/s]water:  50%|█████     | 15/30 [00:05<00:05,  2.56it/s]water:  53%|█████▎    | 16/30 [00:06<00:05,  2.56it/s]water:  57%|█████▋    | 17/30 [00:06<00:05,  2.56it/s]water:  60%|██████    | 18/30 [00:07<00:04,  2.56it/s]water:  63%|██████▎   | 19/30 [00:07<00:04,  2.55it/s]water:  67%|██████▋   | 20/30 [00:07<00:03,  2.55it/s]water:  70%|███████   | 21/30 [00:09<00:05,  1.51it/s]water:  73%|███████▎  | 22/30 [00:09<00:04,  1.67it/s]water:  77%|███████▋  | 23/30 [00:09<00:03,  1.86it/s]water:  80%|████████  | 24/30 [00:10<00:02,  2.02it/s]water:  83%|████████▎ | 25/30 [00:10<00:02,  2.16it/s]water:  87%|████████▋ | 26/30 [00:11<00:01,  2.27it/s]water:  90%|█████████ | 27/30 [00:11<00:01,  2.34it/s]water:  93%|█████████▎| 28/30 [00:11<00:00,  2.40it/s]water:  97%|█████████▋| 29/30 [00:12<00:00,  2.44it/s]water: 100%|██████████| 30/30 [00:12<00:00,  2.48it/s]water: 100%|██████████| 30/30 [00:12<00:00,  2.36it/s]
    SI: 0.763 ± 0.032
    Improvement: -3.8% ± 0.5%
    Regimes: 5
    Verdict: APPENDIX

>>> Testing domain: commodities
commodities:   0%|          | 0/30 [00:00<?, ?it/s]commodities:   3%|▎         | 1/30 [00:00<00:12,  2.37it/s]commodities:   7%|▋         | 2/30 [00:00<00:11,  2.38it/s]commodities:  10%|█         | 3/30 [00:01<00:11,  2.36it/s]commodities:  13%|█▎        | 4/30 [00:01<00:11,  2.28it/s]commodities:  17%|█▋        | 5/30 [00:02<00:10,  2.31it/s]commodities:  20%|██        | 6/30 [00:02<00:10,  2.34it/s]commodities:  23%|██▎       | 7/30 [00:02<00:09,  2.34it/s]commodities:  27%|██▋       | 8/30 [00:03<00:09,  2.35it/s]commodities:  30%|███       | 9/30 [00:03<00:08,  2.36it/s]commodities:  33%|███▎      | 10/30 [00:04<00:08,  2.36it/s]commodities:  37%|███▋      | 11/30 [00:04<00:08,  2.36it/s]commodities:  40%|████      | 12/30 [00:05<00:07,  2.37it/s]commodities:  43%|████▎     | 13/30 [00:05<00:07,  2.36it/s]commodities:  47%|████▋     | 14/30 [00:05<00:06,  2.36it/s]commodities:  50%|█████     | 15/30 [00:06<00:06,  2.36it/s]commodities:  53%|█████▎    | 16/30 [00:06<00:05,  2.37it/s]commodities:  57%|█████▋    | 17/30 [00:07<00:05,  2.37it/s]commodities:  60%|██████    | 18/30 [00:07<00:05,  2.37it/s]commodities:  63%|██████▎   | 19/30 [00:08<00:04,  2.37it/s]commodities:  67%|██████▋   | 20/30 [00:08<00:04,  2.37it/s]commodities:  70%|███████   | 21/30 [00:08<00:03,  2.37it/s]commodities:  73%|███████▎  | 22/30 [00:09<00:03,  2.37it/s]commodities:  77%|███████▋  | 23/30 [00:09<00:02,  2.37it/s]commodities:  80%|████████  | 24/30 [00:10<00:02,  2.37it/s]commodities:  83%|████████▎ | 25/30 [00:10<00:02,  2.37it/s]commodities:  87%|████████▋ | 26/30 [00:11<00:01,  2.38it/s]commodities:  90%|█████████ | 27/30 [00:11<00:01,  2.25it/s]commodities:  93%|█████████▎| 28/30 [00:11<00:00,  2.28it/s]commodities:  97%|█████████▋| 29/30 [00:12<00:00,  2.31it/s]commodities: 100%|██████████| 30/30 [00:12<00:00,  2.33it/s]commodities: 100%|██████████| 30/30 [00:12<00:00,  2.35it/s]
    SI: 0.842 ± 0.035
    Improvement: 20.6% ± 0.5%
    Regimes: 5
    Verdict: INCLUDE

================================================================================
DOMAIN RANKING TABLE
================================================================================
Rank   Domain          SI              Improvement     Verdict   
--------------------------------------------------------------------------------
1      solar           0.856 ± 0.040   11.0% ± 1.2%    INCLUDE   
2      commodities     0.842 ± 0.035   20.6% ± 0.5%    INCLUDE   
3      water           0.763 ± 0.032   -3.8% ± 0.5%    APPENDIX  
4      wikipedia       0.544 ± 0.011   -3.5% ± 0.2%    APPENDIX  
5      air_quality     0.491 ± 0.018   -11.2% ± 0.3%   APPENDIX  
--------------------------------------------------------------------------------

SUMMARY:
  Include in paper: 2 domains
    - solar (SI=0.856, Imp=11.0%)
    - commodities (SI=0.842, Imp=20.6%)
  Move to appendix: 3 domains
    - water (SI=0.763, Imp=-3.8%)
    - wikipedia (SI=0.544, Imp=-3.5%)
    - air_quality (SI=0.491, Imp=-11.2%)

Results saved to: /Users/yuhaoli/code/MAS_For_Finance/emergent_specialization/results/tier1_screening/screening_results.json

============================================================
SCREENING COMPLETE
============================================================
