============================================================
FULL EXPERIMENTS ON WINNING DOMAINS (125 trials)
============================================================

>>> Running Solar (125 trials)...
solar:   0%|          | 0/125 [00:00<?, ?it/s]solar:   1%|          | 1/125 [00:00<00:54,  2.26it/s]solar:   2%|▏         | 2/125 [00:00<00:51,  2.39it/s]solar:   2%|▏         | 3/125 [00:01<00:50,  2.43it/s]solar:   3%|▎         | 4/125 [00:01<00:48,  2.49it/s]solar:   4%|▍         | 5/125 [00:02<00:47,  2.54it/s]solar:   5%|▍         | 6/125 [00:02<00:46,  2.56it/s]solar:   6%|▌         | 7/125 [00:02<00:45,  2.57it/s]solar:   6%|▋         | 8/125 [00:03<00:45,  2.54it/s]solar:   7%|▋         | 9/125 [00:03<00:45,  2.57it/s]solar:   8%|▊         | 10/125 [00:03<00:44,  2.57it/s]solar:   9%|▉         | 11/125 [00:04<00:44,  2.57it/s]solar:  10%|▉         | 12/125 [00:04<00:43,  2.59it/s]solar:  10%|█         | 13/125 [00:05<00:43,  2.59it/s]solar:  11%|█         | 14/125 [00:05<00:42,  2.60it/s]solar:  12%|█▏        | 15/125 [00:05<00:42,  2.60it/s]solar:  13%|█▎        | 16/125 [00:06<00:41,  2.60it/s]solar:  14%|█▎        | 17/125 [00:06<00:41,  2.60it/s]solar:  14%|█▍        | 18/125 [00:07<00:41,  2.60it/s]solar:  15%|█▌        | 19/125 [00:07<00:40,  2.59it/s]solar:  16%|█▌        | 20/125 [00:07<00:40,  2.59it/s]solar:  17%|█▋        | 21/125 [00:08<00:41,  2.51it/s]solar:  18%|█▊        | 22/125 [00:08<00:40,  2.52it/s]solar:  18%|█▊        | 23/125 [00:09<00:41,  2.47it/s]solar:  19%|█▉        | 24/125 [00:09<00:40,  2.50it/s]solar:  20%|██        | 25/125 [00:09<00:39,  2.53it/s]solar:  21%|██        | 26/125 [00:10<00:39,  2.52it/s]solar:  22%|██▏       | 27/125 [00:10<00:38,  2.54it/s]solar:  22%|██▏       | 28/125 [00:11<00:38,  2.53it/s]solar:  23%|██▎       | 29/125 [00:11<00:38,  2.52it/s]solar:  24%|██▍       | 30/125 [00:11<00:37,  2.55it/s]solar:  25%|██▍       | 31/125 [00:12<00:38,  2.45it/s]solar:  26%|██▌       | 32/125 [00:12<00:37,  2.48it/s]solar:  26%|██▋       | 33/125 [00:13<00:38,  2.37it/s]solar:  27%|██▋       | 34/125 [00:13<00:38,  2.39it/s]solar:  28%|██▊       | 35/125 [00:13<00:36,  2.45it/s]solar:  29%|██▉       | 36/125 [00:14<00:35,  2.49it/s]solar:  30%|██▉       | 37/125 [00:14<00:34,  2.52it/s]solar:  30%|███       | 38/125 [00:15<00:34,  2.55it/s]solar:  31%|███       | 39/125 [00:15<00:33,  2.56it/s]solar:  32%|███▏      | 40/125 [00:15<00:33,  2.57it/s]solar:  33%|███▎      | 41/125 [00:16<00:32,  2.58it/s]solar:  34%|███▎      | 42/125 [00:16<00:32,  2.59it/s]solar:  34%|███▍      | 43/125 [00:16<00:31,  2.60it/s]solar:  35%|███▌      | 44/125 [00:17<00:31,  2.60it/s]solar:  36%|███▌      | 45/125 [00:17<00:30,  2.61it/s]solar:  37%|███▋      | 46/125 [00:18<00:30,  2.61it/s]solar:  38%|███▊      | 47/125 [00:18<00:29,  2.61it/s]solar:  38%|███▊      | 48/125 [00:18<00:29,  2.57it/s]solar:  39%|███▉      | 49/125 [00:19<00:29,  2.57it/s]solar:  40%|████      | 50/125 [00:19<00:29,  2.58it/s]solar:  41%|████      | 51/125 [00:20<00:28,  2.58it/s]solar:  42%|████▏     | 52/125 [00:20<00:28,  2.57it/s]solar:  42%|████▏     | 53/125 [00:20<00:27,  2.58it/s]solar:  43%|████▎     | 54/125 [00:21<00:27,  2.59it/s]solar:  44%|████▍     | 55/125 [00:21<00:27,  2.58it/s]solar:  45%|████▍     | 56/125 [00:21<00:26,  2.59it/s]solar:  46%|████▌     | 57/125 [00:22<00:26,  2.59it/s]solar:  46%|████▋     | 58/125 [00:22<00:25,  2.59it/s]solar:  47%|████▋     | 59/125 [00:23<00:25,  2.60it/s]solar:  48%|████▊     | 60/125 [00:23<00:24,  2.60it/s]solar:  49%|████▉     | 61/125 [00:23<00:24,  2.61it/s]solar:  50%|████▉     | 62/125 [00:24<00:24,  2.60it/s]solar:  50%|█████     | 63/125 [00:24<00:23,  2.61it/s]solar:  51%|█████     | 64/125 [00:25<00:23,  2.60it/s]solar:  52%|█████▏    | 65/125 [00:25<00:23,  2.60it/s]solar:  53%|█████▎    | 66/125 [00:25<00:22,  2.60it/s]solar:  54%|█████▎    | 67/125 [00:26<00:22,  2.60it/s]solar:  54%|█████▍    | 68/125 [00:26<00:21,  2.61it/s]solar:  55%|█████▌    | 69/125 [00:26<00:21,  2.61it/s]solar:  56%|█████▌    | 70/125 [00:27<00:21,  2.60it/s]solar:  57%|█████▋    | 71/125 [00:27<00:21,  2.52it/s]solar:  58%|█████▊    | 72/125 [00:28<00:21,  2.43it/s]solar:  58%|█████▊    | 73/125 [00:29<00:37,  1.38it/s]solar:  59%|█████▉    | 74/125 [00:30<00:32,  1.58it/s]solar:  60%|██████    | 75/125 [00:30<00:28,  1.79it/s]solar:  61%|██████    | 76/125 [00:30<00:24,  1.97it/s]solar:  62%|██████▏   | 77/125 [00:31<00:22,  2.11it/s]solar:  62%|██████▏   | 78/125 [00:31<00:20,  2.25it/s]solar:  63%|██████▎   | 79/125 [00:32<00:19,  2.34it/s]solar:  64%|██████▍   | 80/125 [00:32<00:18,  2.41it/s]solar:  65%|██████▍   | 81/125 [00:32<00:17,  2.47it/s]solar:  66%|██████▌   | 82/125 [00:33<00:17,  2.50it/s]solar:  66%|██████▋   | 83/125 [00:33<00:16,  2.53it/s]solar:  67%|██████▋   | 84/125 [00:33<00:16,  2.55it/s]solar:  68%|██████▊   | 85/125 [00:34<00:15,  2.57it/s]solar:  69%|██████▉   | 86/125 [00:34<00:15,  2.58it/s]solar:  70%|██████▉   | 87/125 [00:35<00:14,  2.59it/s]solar:  70%|███████   | 88/125 [00:35<00:14,  2.59it/s]solar:  71%|███████   | 89/125 [00:35<00:13,  2.60it/s]solar:  72%|███████▏  | 90/125 [00:36<00:13,  2.60it/s]solar:  73%|███████▎  | 91/125 [00:36<00:13,  2.60it/s]solar:  74%|███████▎  | 92/125 [00:37<00:12,  2.60it/s]solar:  74%|███████▍  | 93/125 [00:37<00:12,  2.61it/s]solar:  75%|███████▌  | 94/125 [00:37<00:11,  2.60it/s]solar:  76%|███████▌  | 95/125 [00:38<00:11,  2.58it/s]solar:  77%|███████▋  | 96/125 [00:38<00:11,  2.59it/s]solar:  78%|███████▊  | 97/125 [00:39<00:11,  2.50it/s]solar:  78%|███████▊  | 98/125 [00:39<00:10,  2.53it/s]solar:  79%|███████▉  | 99/125 [00:39<00:10,  2.55it/s]solar:  80%|████████  | 100/125 [00:40<00:09,  2.56it/s]solar:  81%|████████  | 101/125 [00:40<00:09,  2.57it/s]solar:  82%|████████▏ | 102/125 [00:40<00:08,  2.59it/s]solar:  82%|████████▏ | 103/125 [00:41<00:08,  2.60it/s]solar:  83%|████████▎ | 104/125 [00:41<00:08,  2.60it/s]solar:  84%|████████▍ | 105/125 [00:42<00:07,  2.59it/s]solar:  85%|████████▍ | 106/125 [00:42<00:07,  2.53it/s]solar:  86%|████████▌ | 107/125 [00:42<00:07,  2.41it/s]solar:  86%|████████▋ | 108/125 [00:43<00:07,  2.40it/s]solar:  87%|████████▋ | 109/125 [00:43<00:06,  2.46it/s]solar:  88%|████████▊ | 110/125 [00:44<00:06,  2.41it/s]solar:  89%|████████▉ | 111/125 [00:44<00:05,  2.47it/s]solar:  90%|████████▉ | 112/125 [00:44<00:05,  2.50it/s]solar:  90%|█████████ | 113/125 [00:45<00:04,  2.53it/s]solar:  91%|█████████ | 114/125 [00:45<00:04,  2.55it/s]solar:  92%|█████████▏| 115/125 [00:46<00:03,  2.56it/s]solar:  93%|█████████▎| 116/125 [00:46<00:03,  2.58it/s]solar:  94%|█████████▎| 117/125 [00:46<00:03,  2.59it/s]solar:  94%|█████████▍| 118/125 [00:47<00:02,  2.60it/s]solar:  95%|█████████▌| 119/125 [00:47<00:02,  2.60it/s]solar:  96%|█████████▌| 120/125 [00:48<00:01,  2.61it/s]solar:  97%|█████████▋| 121/125 [00:48<00:01,  2.60it/s]solar:  98%|█████████▊| 122/125 [00:48<00:01,  2.60it/s]solar:  98%|█████████▊| 123/125 [00:49<00:00,  2.59it/s]solar:  99%|█████████▉| 124/125 [00:49<00:00,  2.60it/s]solar: 100%|██████████| 125/125 [00:49<00:00,  2.60it/s]solar: 100%|██████████| 125/125 [00:49<00:00,  2.50it/s]
    SI: 0.865 ± 0.036
    Improvement: 11.3% ± 1.3%

>>> Running Commodities (125 trials)...
commodities:   0%|          | 0/125 [00:00<?, ?it/s]commodities:   1%|          | 1/125 [00:00<00:53,  2.33it/s]commodities:   2%|▏         | 2/125 [00:00<00:53,  2.32it/s]commodities:   2%|▏         | 3/125 [00:01<00:52,  2.34it/s]commodities:   3%|▎         | 4/125 [00:01<00:51,  2.36it/s]commodities:   4%|▍         | 5/125 [00:02<00:50,  2.36it/s]commodities:   5%|▍         | 6/125 [00:02<00:50,  2.36it/s]commodities:   6%|▌         | 7/125 [00:02<00:49,  2.36it/s]commodities:   6%|▋         | 8/125 [00:03<00:49,  2.37it/s]commodities:   7%|▋         | 9/125 [00:03<00:49,  2.36it/s]commodities:   8%|▊         | 10/125 [00:04<00:48,  2.37it/s]commodities:   9%|▉         | 11/125 [00:04<00:48,  2.36it/s]commodities:  10%|▉         | 12/125 [00:05<00:47,  2.36it/s]commodities:  10%|█         | 13/125 [00:05<00:47,  2.36it/s]commodities:  11%|█         | 14/125 [00:05<00:46,  2.37it/s]commodities:  12%|█▏        | 15/125 [00:06<00:46,  2.37it/s]commodities:  13%|█▎        | 16/125 [00:06<00:46,  2.37it/s]commodities:  14%|█▎        | 17/125 [00:07<00:45,  2.37it/s]commodities:  14%|█▍        | 18/125 [00:07<00:45,  2.37it/s]commodities:  15%|█▌        | 19/125 [00:08<00:44,  2.37it/s]commodities:  16%|█▌        | 20/125 [00:08<00:44,  2.37it/s]commodities:  17%|█▋        | 21/125 [00:08<00:44,  2.36it/s]commodities:  18%|█▊        | 22/125 [00:09<00:43,  2.37it/s]commodities:  18%|█▊        | 23/125 [00:09<00:43,  2.37it/s]commodities:  19%|█▉        | 24/125 [00:10<00:42,  2.37it/s]commodities:  20%|██        | 25/125 [00:10<00:42,  2.36it/s]commodities:  21%|██        | 26/125 [00:11<00:41,  2.36it/s]commodities:  22%|██▏       | 27/125 [00:11<00:41,  2.36it/s]commodities:  22%|██▏       | 28/125 [00:11<00:41,  2.36it/s]commodities:  23%|██▎       | 29/125 [00:12<00:40,  2.36it/s]commodities:  24%|██▍       | 30/125 [00:12<00:40,  2.36it/s]commodities:  25%|██▍       | 31/125 [00:13<00:39,  2.36it/s]commodities:  26%|██▌       | 32/125 [00:13<00:39,  2.36it/s]commodities:  26%|██▋       | 33/125 [00:13<00:38,  2.36it/s]commodities:  27%|██▋       | 34/125 [00:14<00:38,  2.36it/s]commodities:  28%|██▊       | 35/125 [00:14<00:38,  2.36it/s]commodities:  29%|██▉       | 36/125 [00:15<00:37,  2.37it/s]commodities:  30%|██▉       | 37/125 [00:15<00:37,  2.37it/s]commodities:  30%|███       | 38/125 [00:16<00:36,  2.37it/s]commodities:  31%|███       | 39/125 [00:16<00:36,  2.37it/s]commodities:  32%|███▏      | 40/125 [00:16<00:35,  2.37it/s]commodities:  33%|███▎      | 41/125 [00:17<00:35,  2.37it/s]commodities:  34%|███▎      | 42/125 [00:17<00:35,  2.37it/s]commodities:  34%|███▍      | 43/125 [00:18<00:34,  2.37it/s]commodities:  35%|███▌      | 44/125 [00:18<00:34,  2.37it/s]commodities:  36%|███▌      | 45/125 [00:19<00:33,  2.37it/s]commodities:  37%|███▋      | 46/125 [00:19<00:33,  2.37it/s]commodities:  38%|███▊      | 47/125 [00:19<00:32,  2.37it/s]commodities:  38%|███▊      | 48/125 [00:20<00:32,  2.37it/s]commodities:  39%|███▉      | 49/125 [00:20<00:32,  2.37it/s]commodities:  40%|████      | 50/125 [00:21<00:31,  2.36it/s]commodities:  41%|████      | 51/125 [00:21<00:31,  2.36it/s]commodities:  42%|████▏     | 52/125 [00:21<00:30,  2.37it/s]commodities:  42%|████▏     | 53/125 [00:22<00:31,  2.32it/s]commodities:  43%|████▎     | 54/125 [00:22<00:30,  2.32it/s]commodities:  44%|████▍     | 55/125 [00:23<00:30,  2.33it/s]commodities:  45%|████▍     | 56/125 [00:23<00:29,  2.35it/s]commodities:  46%|████▌     | 57/125 [00:24<00:28,  2.35it/s]commodities:  46%|████▋     | 58/125 [00:24<00:28,  2.36it/s]commodities:  47%|████▋     | 59/125 [00:24<00:28,  2.36it/s]commodities:  48%|████▊     | 60/125 [00:25<00:27,  2.36it/s]commodities:  49%|████▉     | 61/125 [00:25<00:27,  2.36it/s]commodities:  50%|████▉     | 62/125 [00:26<00:26,  2.37it/s]commodities:  50%|█████     | 63/125 [00:26<00:26,  2.37it/s]commodities:  51%|█████     | 64/125 [00:27<00:25,  2.37it/s]commodities:  52%|█████▏    | 65/125 [00:27<00:25,  2.37it/s]commodities:  53%|█████▎    | 66/125 [00:27<00:24,  2.37it/s]commodities:  54%|█████▎    | 67/125 [00:28<00:24,  2.37it/s]commodities:  54%|█████▍    | 68/125 [00:28<00:24,  2.35it/s]commodities:  55%|█████▌    | 69/125 [00:29<00:24,  2.31it/s]commodities:  56%|█████▌    | 70/125 [00:29<00:23,  2.33it/s]commodities:  57%|█████▋    | 71/125 [00:30<00:23,  2.34it/s]commodities:  58%|█████▊    | 72/125 [00:30<00:22,  2.35it/s]commodities:  58%|█████▊    | 73/125 [00:30<00:22,  2.36it/s]commodities:  59%|█████▉    | 74/125 [00:31<00:21,  2.34it/s]commodities:  60%|██████    | 75/125 [00:31<00:21,  2.35it/s]commodities:  61%|██████    | 76/125 [00:32<00:20,  2.36it/s]commodities:  62%|██████▏   | 77/125 [00:32<00:20,  2.36it/s]commodities:  62%|██████▏   | 78/125 [00:33<00:19,  2.37it/s]commodities:  63%|██████▎   | 79/125 [00:33<00:19,  2.37it/s]commodities:  64%|██████▍   | 80/125 [00:33<00:18,  2.37it/s]commodities:  65%|██████▍   | 81/125 [00:34<00:18,  2.37it/s]commodities:  66%|██████▌   | 82/125 [00:34<00:18,  2.37it/s]commodities:  66%|██████▋   | 83/125 [00:35<00:17,  2.37it/s]commodities:  67%|██████▋   | 84/125 [00:35<00:17,  2.37it/s]commodities:  68%|██████▊   | 85/125 [00:36<00:16,  2.36it/s]commodities:  69%|██████▉   | 86/125 [00:36<00:16,  2.37it/s]commodities:  70%|██████▉   | 87/125 [00:36<00:16,  2.37it/s]commodities:  70%|███████   | 88/125 [00:37<00:15,  2.37it/s]commodities:  71%|███████   | 89/125 [00:37<00:15,  2.36it/s]commodities:  72%|███████▏  | 90/125 [00:38<00:18,  1.87it/s]commodities:  73%|███████▎  | 91/125 [00:39<00:26,  1.30it/s]commodities:  74%|███████▎  | 92/125 [00:40<00:22,  1.50it/s]commodities:  74%|███████▍  | 93/125 [00:40<00:19,  1.68it/s]commodities:  75%|███████▌  | 94/125 [00:41<00:16,  1.84it/s]commodities:  76%|███████▌  | 95/125 [00:41<00:15,  1.97it/s]commodities:  77%|███████▋  | 96/125 [00:41<00:13,  2.07it/s]commodities:  78%|███████▊  | 97/125 [00:42<00:13,  2.15it/s]commodities:  78%|███████▊  | 98/125 [00:42<00:12,  2.21it/s]commodities:  79%|███████▉  | 99/125 [00:43<00:11,  2.25it/s]commodities:  80%|████████  | 100/125 [00:43<00:10,  2.28it/s]commodities:  81%|████████  | 101/125 [00:44<00:10,  2.31it/s]commodities:  82%|████████▏ | 102/125 [00:44<00:09,  2.33it/s]commodities:  82%|████████▏ | 103/125 [00:44<00:09,  2.34it/s]commodities:  83%|████████▎ | 104/125 [00:45<00:08,  2.35it/s]commodities:  84%|████████▍ | 105/125 [00:45<00:08,  2.35it/s]commodities:  85%|████████▍ | 106/125 [00:46<00:08,  2.35it/s]commodities:  86%|████████▌ | 107/125 [00:46<00:07,  2.36it/s]commodities:  86%|████████▋ | 108/125 [00:47<00:07,  2.36it/s]commodities:  87%|████████▋ | 109/125 [00:47<00:06,  2.35it/s]commodities:  88%|████████▊ | 110/125 [00:47<00:06,  2.35it/s]commodities:  89%|████████▉ | 111/125 [00:48<00:05,  2.36it/s]commodities:  90%|████████▉ | 112/125 [00:48<00:05,  2.36it/s]commodities:  90%|█████████ | 113/125 [00:49<00:05,  2.32it/s]commodities:  91%|█████████ | 114/125 [00:49<00:04,  2.33it/s]commodities:  92%|█████████▏| 115/125 [00:50<00:04,  2.32it/s]commodities:  93%|█████████▎| 116/125 [00:50<00:03,  2.30it/s]commodities:  94%|█████████▎| 117/125 [00:50<00:03,  2.32it/s]commodities:  94%|█████████▍| 118/125 [00:51<00:02,  2.34it/s]commodities:  95%|█████████▌| 119/125 [00:51<00:02,  2.33it/s]commodities:  96%|█████████▌| 120/125 [00:52<00:02,  2.32it/s]commodities:  97%|█████████▋| 121/125 [00:52<00:01,  2.33it/s]commodities:  98%|█████████▊| 122/125 [00:53<00:01,  2.27it/s]commodities:  98%|█████████▊| 123/125 [00:53<00:00,  2.07it/s]commodities:  99%|█████████▉| 124/125 [00:54<00:00,  2.13it/s]commodities: 100%|██████████| 125/125 [00:54<00:00,  2.19it/s]commodities: 100%|██████████| 125/125 [00:54<00:00,  2.29it/s]
    SI: 0.839 ± 0.039
    Improvement: 20.5% ± 0.7%

============================================================
FULL EXPERIMENT RESULTS
============================================================

Domain        | SI          | Improvement  | Status
--------------|-------------|--------------|--------
Solar         | 0.865 ± 0.036 | +11.3% ± 1.3% | ✓ Strong
Commodities   | 0.839 ± 0.039 | +20.5% ± 0.7% | ✓ Strong

Results saved to: results/tier1_full_experiments/full_results.json
